"Speaker Name","Start Time","End Time","Text""James Somerton","00:22:12:13","00:22:36:06","Agents and to America to speed up the downfall of decadent capitalism with her own even more toxic version of capitalism. Now her thought process is flawed for a number of reasons, chiefly the naive insanity of assuming that those who refuse to innovate will simply bow their heads and gracefully fade away from the market to make way for the new innovators and the corporations and individuals with sufficient wealth will not flex their wealth to shut down competition."
"James Somerton","00:22:36:08","00:23:07:14","And for all, Rand blamed the government for restricting glorious freedom. The corporate oligarchy of America influences the government to protect their interests. These interests include the hidden copyright vault in General Electric, Nokia and Big Pharma in general, which each housed the technology to throw us into a utopic age because their largest yearly expense is buying up patented technology developed at universities to make sure they never see the light of day in order to foster the consumer public's dependency on their existing profit driven products."
"James Somerton","00:23:07:19","00:23:30:18","And because this always comes back to Disney. This also includes their influence over American lawmaking to chronically extend the date of intellectual property ownership expiry suddenly, capitalism isn't a meritocracy anymore. It rewards people of wealth with more wealth than everyone else. Do they get to be individuals? There is a possible reading of Season three that discusses this examine Hawkins."
"James Somerton","00:23:30:20","00:23:48:21","Almost everybody who isn't in the main cast. Each season depicts a clear throughline of groupthink. You are to like what society expects you to like. You are to eat what you are expected to eat. You are within an established expectation of behavior. You are expected to listen to a certain kind of music and you face public ridicule if you do not conform as closely as possible."
"James Somerton","00:23:49:09","00:24:08:01","The government does not need to enforce behavior when the public does it for them. Because the thing about consumer based capitalism is that it's far easier to sell a product if the whole population enjoys it. And if there was any artistic innovation of the 1980s, it was how to convince a population to enjoy something they may not otherwise enjoy."
"James Somerton","00:24:08:07","00:24:29:06","Tip If you present your product as if everyone already likes it, people will decide that they want to like it because they want to like what everybody else likes. And suddenly, popularity and being liked by others boils down to a matter of who can exemplify the most archetypal version of American that a given population has decided upon. Thanks, McCarthyism, and this has social feedback as well."
"James Somerton","00:24:29:08","00:24:50:03","Skip ahead to season four, where Hawkins goes on a vigilante spree against a Dungeons and Dragons group. You're not supposed to like nerd things. You're supposed to like basketball. So if you like Dungeons and Dragons, there must be something wrong with you, something delinquent. And if there's one delinquent thing about you, then it's not a stretch to say that you are a ritualistic demon worshiper."
"James Somerton","00:24:50:04","00:25:10:10","Funny thing is, this actually happened. There really was a widespread component of the Satanic panic which zeroed in on Dungeons and Dragons, but also bled over into the 1990s with things like Magic, the Gathering, and maybe not specifically tied to Daddy, but there were public vigilante mobs that targeted people who were accused of living outside Christian normativity. Just look at the story of the San Antonio four."
"James Somerton","00:25:10:12","00:25:32:14","But back to season three. You have a giant flesh monster made up of good capitalist Toms and Janes attacking our heroic group of weirdos, a capitalist collective trying to murder a bunch of social outcasts. The statement here is that this American freedom brought about by capitalism doesn't really exist. All consumers are just part of the same flesh monster at the end of the day, where they continue to consume."
"James Somerton","00:25:33:00","00:25:54:22","But now they consume you. But the problem with season three is that while this discourse is going on, we get sucked into situations where the plot is stopped to remember something from the 1980s Neverending Story. And it's also worth mentioning that the day was saved in part due to dangerously unregulated fireworks crafted into improvised explosives. There is."
"Speaker 3","00:25:54:22","00:26:01:16","A reason this warning label says 18 or older, this sucker is filled with 150 grains of black."
"Speaker 2","00:26:01:16","00:26:04:04","Powder, a.k.a. gunpowder."
"Speaker 5","00:26:04:17","00:26:06:09","Believe this. You see? Piece of shit."
"James Somerton","00:26:11:00","00:26:40:19","Which establishes two conflicting languages, one which subverts nostalgia and one which promotes it. So I question whether the subversion was the intended reading or just an incidental inclusion as a result of half the season needing to take place in a shopping mall. Confusing and inconsistent literary language makes for messy analysis, and I feel like because Season three contains so much nostalgia, content, leaning in one direction or the other could definitively answer whether the series as a whole is using nostalgia as a selling point or whether it's subverting it."
"James Somerton","00:26:41:02","00:26:49:06","But once again, we're at a troubled spot. A definition or description of the uses of nostalgia is not very helpful for telling us how to identify it."
"James Somerton","00:27:00:22","00:27:23:03","The tricky thing about nostalgia is that sometimes media just takes place in a bygone era. Historic fiction. Another thing is that younger generations who never lived in the 1980s say it can be found reminiscing about the decade for the sake of esthetics. Community values and longing to be part of a specific social movement that lived and died before the Clinton administration."
"James Somerton","00:27:23:10","00:27:43:07","The latter case is problematic because people in these instances often overlook the unflattering components of the past. Q A bunch of gay people my age and younger who wish they'd been born in New York or San Francisco a few decades ago so that they could have been a part of proper gay society without acknowledging the terror that queer people lived under every day."
"James Somerton","00:27:43:10","00:28:04:16","And the reason this culture was so vibrant was because we desperately needed counterprogramming to the gloom of everyday existence. And so it's not always the eighties. For some it's the seventies with disco and experimental rock. For others, it's the sixties with soul and Woodstock. My question being, how can nostalgia be used to describe these feelings of people my age?"
"James Somerton","00:28:04:16","00:28:26:03","If the definition of nostalgia requires memories or lived experiences? Another question is when is nostalgia intended for? Take a book like The Great Gatsby by F Scott Fitzgerald. These days it's held up as a token of literary canon and taught in many high schools to frame a discourse around the 1920s and modernism in prose literature. At the time, it was considered to be a failure."
"James Somerton","00:28:26:04","00:28:48:20","Next to Fitzgerald's other successful novels and was largely ignored. However, it was rediscovered after the Second World War and held up as a relic that described the cultural mindset of the Roaring Twenties at its peak. Even though it was intended written for a 1920s audience, could we say that this is nostalgic media because it offered a sense of nostalgia to an audience in the 1950s?"
"James Somerton","00:28:49:06","00:29:11:03","It's difficult to find media that celebratory of the day and age that it's made in. Creators, as per their nature, are often critical of social conventions and use fiction as a way to highlight these frustrations. Can we say then, that nostalgia as creators may use it to depict the past is used to contextualize criticisms they have about contemporary society?"
"James Somerton","00:29:11:11","00:29:40:04","But again, is there a clear line between nostalgia and historical fiction? Can you have one without the other? You could even say that something like the Medieval Fantasy or even Dungeons and Dragons itself is nostalgic because the Dungeon Master doesn't make a point of killing off half of the side cast from dysentery, which honestly is probably why things like Game of Thrones typically focus around the wealthier classes who had the privilege to afford things like medicine and basic hygiene."
"James Somerton","00:29:40:09","00:29:59:00","But it does contribute to a concept of nostalgia in which the inconvenient, embarrassing or harmful elements of the past are forgotten in exchange for the ability to frame a particular story in an esthetic setting. The end result of nostalgic fiction seems to be the argument. Wasn't this time in history kind of great. Wouldn't you want to be alive then?"
"James Somerton","00:29:59:06","00:30:19:15","For me personally, not a day before penicillin and air conditioning, but where is the line drawn in general and how do we identify this kind of nostalgia? Well, it's probably best to go over some examples we've already touched on. Ready Player one and the consequences of the framing devices it uses to moralize contemporary culture versus those of the past."
"James Somerton","00:30:20:08","00:30:23:08","But it's far from being the only one of its kind."
"James Somerton","00:30:26:15","00:30:49:04","Downton Abbey is one of the most successful English shows of all time, appealing to audiences of all stripes by using the centuries old upstairs downstairs dynamic of telling stories of the rich and the poor who support them again with the emotional support force. You can watch the show in French, German, Korean, Russian, Persian, and it had an estimated global audience of 160 million viewers at its peak in 2014."
"James Somerton","00:30:49:11","00:31:08:10","Yet Downton Abbey is just the newest in a long line of conservative propaganda that gets lapped up by audiences yearning for the good old days of yore. From Merchant Ivory Films to Notting Hill, much of England's media exports have been reinforcing old world class stereotypes that we modern people seem to love for some reason. Downton is a world where rules matter."
"James Somerton","00:31:08:16","00:31:44:07","How you dress for a meal which spoon you use the right time to visit a new neighbor. The life of Downton's characters is a choreographed dance punctuated by seasonal celebrations, daily and weekly rituals, and celebrating a lifestyle that has been regulated by the same chain of tradition, rules and expectations for centuries. The sanctity of the country house, as ordered, harmonious and class bound was never really challenged, and the audience cheered when the various selfish and evil characters, usually amongst the powers, were sent on their way by nice, loyal porters who knew their place."
"James Somerton","00:31:44:13","00:32:09:22","Whilst the series did toy with things like Irish politics, the suffragette movement, homosexuality and middle class identity, it shied away from any real critique of English society at the time. Heritage television, like this, is regularly criticized for engendering nostalgia about an idealized past in a classic critique. The film scholar Andrew Higson suggested that such work served to present a conservative Englishness that never really existed."
"James Somerton","00:32:10:04","00:32:34:19","It is inarguable that Downton Abbey presents a kind of lovingly rendered, unquestioned version of the past in the first Downton movie. Lady Mary Crawley, a key member of the family, was wondering whether the time had come to sell the grand British estate home to a handful of aristocrats and their army of servants. Maybe the family should move to a more reasonably sized large manor and turn Downton into something useful, like a school."
"James Somerton","00:32:34:23","00:32:54:18","But her maid begged her to keep Downton in the family forever, a symbol of glory and honor for the staff and surrounding town. Don't you see all the poor people ever really wanted was more aristocracy. The show and the movies that have followed have always taken a romantic view of the old economic hierarchy we're supposed to be moving past."
"James Somerton","00:32:54:22","00:33:21:18","Yes. This is a period piece written by Julian Fellowes. The most period of British period writers. He's also a conservative member of the House of Lords, and yet so much of actual 1920s history goes on scene. At the time, the British labor movement was gaining traction. While British newspapers were breathlessly covering the social lives of the aristocracy, some people were pushing for the abolition of hereditary titles and demanding that Noble's land be taxed."
"James Somerton","00:33:21:23","00:33:44:18","In 1928, working class women would get the right to vote. Within 20 years, the entire system would fall apart and domestic service would go from being one of Britain's largest sectors of employment for women to being virtually non-existent. Few working class tears were shed for the end of that era. But if you've done little research into this history and only know it the way Julian Fellowes wants you to know it, you wouldn't know that."
"James Somerton","00:33:45:00","00:33:59:21","In fact, you'd think it was damn near the downfall of England as a whole, and that even the poorest of the poor were heartbroken to see the ultra rich losing some of their titles and land. So why do so many of us watch this show with a romantic feeling in our hearts?"
"Speaker 2","00:34:00:00","00:34:12:00","The servants have been stuck downstairs long enough. Yes. It's time we go upstairs, sir. Wait. What do you mean? I'm talking about a revolt. I'm talking about a worker uprising."
"James Somerton","00:34:12:01","00:34:39:22","Yet others among us, myself included layer aspiration with resentment on fictional shows like HBO Succession about a family that owns a global media empire. Luxury porn goes down with a chaser of self-satisfaction. Those Grand Summer homes and helicopter rides are symbols of moral decay. In real life, we lap up the college admissions scandal and the nouveau riche ostentatious snaps of real housewives taking satisfaction when the rich people's self-serving tackiness catches up with them."
"James Somerton","00:34:40:06","00:35:07:16","And we know that the waitstaff is watching with clear eyes and the power to topple the system from within. Like the bartender whose secret 47% video helped to doom Mitt Romney's 2012 run for president in Downton Abbey, There's no threats like that. The worst case scenario is a valet spills some soup and there's a stability in that kind of thing that makes us nostalgic for a time when one small mistake, one missed payment, one forgotten appointment wouldn't lead to you being homeless or without a doctor."
"James Somerton","00:35:07:19","00:35:31:04","But the nostalgia portrayed in Downton is a fantasy. There's this portrayal of a kinder set of relationships between people of different economic classes. The servant characters in Downton, like the maid and Dressing Lady Mary, feel a bond to their masters that isn't just economic, but emotional. And the aristocrats feel an obligation to their servants welfare and appreciation for even the dressing and polishing skills that they bring to the table."
"James Somerton","00:35:31:11","00:35:53:04","Priya Sasha, a Stanford University history professor, said of this We're wise enough to know that this is a romantic, very idealized depiction of servant and master relations, but we just find it so attractive. If we're going to have inequality, can it at least be nice? Can the dignity of every kind of work be acknowledged? This is it's true."
"James Somerton","00:35:53:04","00:36:15:13","The difference between Downton style inequality and the transactional relationships of today's economy. Gone are the days of benevolent corporate paternalism, a social compact that ranged from pension funds to full on company towns. Now pensions are outsourced to 401 ks. Health care costs are passed on to the employees and within the confines of the gig economy, employer employee relationships don't exist at all."
"James Somerton","00:36:15:20","00:36:35:11","So nostalgia for those good old days can creep into our mind while watching the show, even though those good old days never really existed. The poor is lucky enough to land jobs with the riches who didn't treat them like crap. We're almost always white, Christian, straight, cisgender, and spoke English as a first language. Everyone else could die in a hole and often did."
"James Somerton","00:36:35:18","00:36:55:01","And for those who did have work, there wasn't a whole lot of camaraderie and love for the upper classes. It was a business arrangement where both parties resented the other for their existence. There's a reason the servants were in the basement or in another house altogether, and no amount of BBC programs where the rich and poor celebrating Christmas together will ever change that."
"James Somerton","00:36:55:08","00:37:16:09","Yes, it was likely true that some of the staff would become attached to their patrons. Usually those who worked closer to the patrons and whose responsibilities weren't so degrading. Also the ones who would be paid considerably more. I can also see it being a trend among rich people, the ones educated enough to write logs to be kept for historic record."
"James Somerton","00:37:16:23","00:37:38:06","For them to imagine having been much kinder to their servants than the servants may have felt. Laughing at your boss's bad jokes is a great way to get a raise or promotion after all. I've seen modern media where rich ladies will start to see their Hispanic housekeeper as their real friends. And I've seen people on Twitter report how bonkers weird it is to be on the receiving end of those affections."
"James Somerton","00:37:38:11","00:38:02:23","The servants in Downton Abbey were employees, not family. The poor survival depended on them being able to navigate the nuances of that relationship. The more they started to think of them like family, the more cutthroat things would get in the kitchens. And it's very telling. I think, that the story of Downton Abbey, at least as of now, ends in 1928, the year before the Lords and Capitalists of the day destroyed the global economy."
"James Somerton","00:38:03:07","00:38:30:17","But no one really has nostalgic yearnings for the Great Depression. So I doubt we'll be seeing Lord Julian Fellowes tackling that anytime soon. Greece is a 1978 film adaptation of the 1971 musical of the same name taking place in the autumn semester of high school in 1958. This film itself is indicative of a nostalgic longing for that decade, which would define the cultural sensibilities of the 1950s."
"James Somerton","00:38:31:01","00:38:52:06","Greece features an archetypal plot line of a girl and a boy in high school. The boy is afraid to be sensitive with the girl because he faces social ridicule for being a boy with feelings. And the girl struggles to find a way to convince him to open up to her. The resolution of this boy and girl heterosexual dilemma is that the girl decides she's going to completely shift her esthetic to be a living pinup poster."
"James Somerton","00:38:52:19","00:39:16:06","And while she rocks the look, it's a terrible message to send to girls wondering why boys are jerks. No dangling cleavage on a string like a carrot from a fishing pole in front of a horse. Will not get him to shape up. Greece's main appeal is the entire environment of presenting the 1950s. Having spoken to older people about this movie, they claim it is very accurate to capturing the social environment of the day and age."
"James Somerton","00:39:16:10","00:39:37:10","Rumor mills, drive ins, milkshake diners, boys with their cars and broken hearts at high school dances and outside of redeeming girls who are unashamed of not being like the other girls in school like Rizzo. There isn't really that much in Greece that offers a social commentary. Greece kind of functions like this museum exhibit a recreation of a dilapidated temple of Eisenhower era America."
"James Somerton","00:39:37:14","00:39:56:16","And as this is Eisenhower's America, a discussion about the disagree section of schools is never mentioned. There are no black or Asian characters of note. There is nary a mention of homophobia, severe bullying, nor any other kind of social problems which plagued the 1950s as per the depiction in Greece. The fifties seemed like an absolute bestest ever time to be alive."
"James Somerton","00:39:56:19","00:40:16:03","The positive elements of the decade are removed entirely from the cultural reality of the era and what we have is this dreamlike fifties fantasy where everyone is having a great time. 16 year olds can have amazing cars. Smoking doesn't cause cancer, and pregnancy was the worst possible outcome from sex. And you may say, but James, can't you just let people like happy things?"
"James Somerton","00:40:16:08","00:40:33:00","To which I say, I really like Greece. I performed songs from Greece, a talent shows for three years straight in elementary school. Nearly every song is an absolute banger, and even the side characters have stuff to do, namely the girls. But I digress. The problem with media like this is when I ask, What's a piece of media about the fifties?"
"James Somerton","00:40:33:16","00:40:53:08","You think of Greece or other media like Greece, whereas media set in the fifties that points out how it wasn't a party for everybody often gets pushed to the wayside. I don't have a problem with fun, whimsical media about the past, especially if, like Greece, the framing devices of the film highlight. This is a very dreamlike and fantastical depiction of the subject matter."
"James Somerton","00:40:53:08","00:41:27:18","The problem becomes when a given public actively ignores and forgets media, which depicts a given time period a little more earnest. And that's not to say that you can't have a dreamlike, whimsical musical media that doesn't incorporate systemic social issues. John Waters's Hairspray is a gay old time dripping in nostalgic love for the 1960s, and yet it also contains woven into the plot itself reminders of the systemic social issues that were still prevalent in the sixties and today, which, to the advantage of the musical film genre, you can trick people into absorbing social commentary a whole lot easier if the songs are catchy."
"James Somerton","00:41:30:18","00:41:55:01","Most people never knew that The Sound of Music, one of the most famous and well-regarded musicals of all time, is actually about resisting Nazis. But that's because they didn't know the movie kept going after Maria gets married to Georg von Trapp and how it's exclusively about the family fighting Nazis with music and passive resistance. Because it was released on to VHS and we pretend Tape two didn't exist."
"James Somerton","00:41:55:06","00:42:13:01","Fun fact if you are a commanding officer in the military where you are being encouraged to commit war crimes, you can actually leave your country. That's an option and it is ethical. There really isn't a just following orders argument that turns out well for the person using it. The Sound of Music follows the musical journey of Maria, a young woman studying to be a nun."
"James Somerton","00:42:13:09","00:42:31:22","Unfortunately, she's got her head in the clouds and not in the kind of way the Catholics appreciate with the intent of giving her something productive to do. The convent sends her to the Von Trapp estate to be the governess of a retired naval officer. Seven children. The children are reeling from the house being run like a Navy vessel since the death of their mother struggled to open up to Maria."
"James Somerton","00:42:31:22","00:42:55:10","But through the Sound of Music, she wins them over and eventually their father. Keep in mind, this is actually a true story. However, as Georg von Trapp is a renowned Austrian officer and the Baron, the rising Nazi party, desperate for military legitimacy, commands him to return to his post. Georg does not at all like the idea of the Nazi Party and loathes how the Austrian government handed itself over to Hitler."
"James Somerton","00:42:55:12","00:43:15:19","He and Maria agree to flee the country by traversing the Alps and relocate to America, where they have more children and become a sensationally famous family choir. Now, when it comes to the musical, a lot of the Nazi stuff is kept on the periphery. It's really only brought up early on through the eldest daughter, Louisa, and her teenage love interest Ralf, because of course, they named the pretty boy Nazi Rolf."
"Speaker 2","00:43:15:23","00:43:18:20","I was born in Dusseldorf and that is why they call me Rolf."
"James Somerton","00:43:18:22","00:43:40:00","So with the Nazi stuff in the background, a lot of the Sound of Music is about a callback to when life was good and simple, living in an era like the Weimar Republic. The natural historic beauty of an Austrian city that had not been decimated by the First World War. And when family values fought against rigid conformity. And if you stop watching the sound of Music at the wedding, this is the nostalgia you get."
