"Speaker Name","Start Time","End Time","Text""James Somerton","00:34:25:19","00:34:28:19","Did, the allegorical monster being worse than the actual monster kind."
"Nick Herrgott","00:34:28:19","00:34:42:05","Of thing. One thing I wish there was more because there was this one we touched on briefly was planting mistrust of everyone when it was kind of revealed that What's her name? Not Loretta. Loretta No. Shapeshifter girl."
"James Somerton","00:34:42:17","00:34:43:05","Nimona."
"Nick Herrgott","00:34:43:06","00:34:43:19","Nimona."
"James Somerton","00:34:44:00","00:34:44:15","It's the movie."
"Nick Herrgott","00:34:45:02","00:34:57:19","Name. I know. I completely blanked when it kind of found out that she can. She's a shape shifter. She started to be like, Oh, she could be anyone. And then, like, you know, you saw people being mistrustful of each other, backing."
"James Somerton","00:34:57:19","00:34:58:12","Away from their friends."
"Nick Herrgott","00:34:58:13","00:35:04:21","I would like I would have liked to see more of that. Maybe a specific reference to being mistrusting someone inside the public bathroom."
"Speaker 2","00:35:04:21","00:35:05:17","Like, yeah."
"Nick Herrgott","00:35:06:16","00:35:09:02","Kind of getting a little bit deeper into that."
"James Somerton","00:35:09:02","00:35:12:15","I mean, I can understand why they wouldn't want to deal with the bathroom thing specifically."
"Nick Herrgott","00:35:12:18","00:35:16:16","Yeah, but like having this kind of more specific interests, but like, oh, anyone could be trans."
"James Somerton","00:35:16:22","00:35:21:01","And again, that's why I'm like, you know, an extra 20 to an extra 20 or 30 minutes into the movie. Yeah."
"Nick Herrgott","00:35:21:08","00:35:27:01","But they were expensive at that point. They were actually running low on time. That was coming. That was at the beginning of the third act."
"James Somerton","00:35:27:02","00:35:28:17","Yeah, I like that kind of so they."
"Nick Herrgott","00:35:28:17","00:35:30:13","Had to get this ball rolling."
"James Somerton","00:35:30:17","00:35:44:04","And keeping in mind as well, like length, like I'm like, Oh, they should have done another half hour. They were abandoned by Disney and left to fend for themselves with an independent production company. They so they probably didn't have a ton of money in animation as."
"Nick Herrgott","00:35:44:04","00:35:50:03","Expected, like all of these gaps, I guess. And I'm willing to forgive it's for for this reason because it didn't really feel like the movie was missing anything."
"James Somerton","00:35:50:05","00:35:53:18","No, it wasn't missing exactly. It didn't feel like it was missing anything."
"Nick Herrgott","00:35:54:01","00:36:00:18","But I'm just pointing out things that they kind of put their toe into a little bit so they could have expanded if they wanted to."
"James Somerton","00:36:00:18","00:36:18:04","Yeah. And I'm kind of looking at it as like, everybody go watch it. So we got a sequel. Yeah, right. So that the sequel can kind of expand upon this because I would like Riz Ahmed to have more work. He's a very talented actor and he doesn't get paid. He doesn't get working off because he's brown resume and he was in."
"Speaker 2","00:36:20:06","00:36:20:17","Whole."
"James Somerton","00:36:21:00","00:36:30:15","Shit. I forget the movie's name. He was in Rogue One. He was in I forget the name of the movie. I think he got an Oscar nomination for it. Oh, he's."
"Nick Herrgott","00:36:30:15","00:36:37:05","Cute. Yeah, he wasn't Rogue one. I have heard, like, Oscar buzz for him. Oh, it seems like he got an Oscar."
"James Somerton","00:36:37:23","00:36:45:19","Oh. Oh, he did win an Oscar. Yeah. Yeah, that was. I forget what that was for, I think. I think that was for the Jake Gyllenhaal movie."
"Nick Herrgott","00:36:46:10","00:36:49:19","Yeah, Maybe. I mean, Academy Award winner resume ADD. Yeah."
"James Somerton","00:36:50:23","00:36:56:23","And for. Oh, also for people who know who she is. Frances Conroy. Also, she voices a character in this."
"Nick Herrgott","00:36:57:10","00:37:03:10","And the director, right. Um, the blond woman. Yes."
"James Somerton","00:37:03:12","00:37:19:05","Yeah. And Frances Conroy was on Six Feet Under and she was also, you know, famous for being an American horror story. Balenciaga like playing Myrtle Snow and lots of other characters. But she's been, you know, very famous lately for American Horror Story. She's in there. Oh, that's."
"Nick Herrgott","00:37:19:05","00:37:21:10","Her. I know when I know who Myrtle is."
"Speaker 2","00:37:21:16","00:37:22:00","Yeah."
"James Somerton","00:37:22:20","00:37:34:15","So it's like it's a super queer, inclusive cast. And even the characters that aren't played or played by queer people are played by, like, dyed in the Wool allies. Yeah, yeah, yeah. And it's just it's so refreshing."
"Speaker 2","00:37:34:19","00:37:35:23","To see a movie."
"James Somerton","00:37:36:06","00:37:53:16","Where there's, like, no caveats. There's no the animators were put through hell. There's no, the main actors are shit head. There's no the director sexually assaulted someone, right. There's none of it. It's just like I can just enjoy this. And not only can I just enjoy it, it's gay."
"Nick Herrgott","00:37:53:16","00:38:04:14","Yeah, it's. I was, like, surprised. Like I said, first 5 minutes after the introduction, kind of like Prolog. Like, it's like, Oh, they're there. Oh, they're getting close. Oh, hands are touching. Oh, they're leaning."
"James Somerton","00:38:04:20","00:38:05:21","Yeah. Guys like other lean."
"Speaker 2","00:38:06:04","00:38:08:18","Oh, got his head is on his shoulder and."
"James Somerton","00:38:09:09","00:38:17:13","I'm like, oh my God. They went there and then when they actually had the kiss at the end, I was like, oh they, they beat the urine ice curse. Yeah. Like they, they, they stepped."
"Speaker 2","00:38:17:13","00:38:18:17","Over the line. They do this."
"Nick Herrgott","00:38:20:05","00:38:24:20","I'm not going to lie like, especially because from being on some streams and people being like, your voice is."
"James Somerton","00:38:24:20","00:38:26:16","So, oh I have no problem with your."
"Nick Herrgott","00:38:26:18","00:38:35:21","On. And that's what I mean. Like I want more like urine I swear it's like abundantly apparent, but it's like, you know, never quote unquote confirmed and like yes I want to."
"Speaker 2","00:38:36:11","00:38:36:18","Just."
"James Somerton","00:38:37:10","00:38:52:03","I that's just like my but you're on ice is my like it's obvious but you know, they just stayed behind that one line and I know why because of censorship laws and all that sort of stuff. Not censorship laws. It's the advertising."
"Nick Herrgott","00:38:52:12","00:38:55:15","Well, yeah, not even that. But like, I will push back against that being like."
"James Somerton","00:38:55:16","00:39:00:02","No, it's fine. It's not about it's not about the relationship. It's about you're is kind of just that."
"Nick Herrgott","00:39:00:02","00:39:04:05","But I think it's still qualifying to believe that even if there isn't any kissing because."
"James Somerton","00:39:04:05","00:39:06:04","If anyone says you're on ice and gay as fuck, they're."
"Nick Herrgott","00:39:06:04","00:39:13:04","Not. Yeah, because like guys like, you know, asexual people exist and sometimes they don't like kissing and that doesn't mean they don't like being romantic."
"James Somerton","00:39:13:04","00:39:34:05","And I actually getting very off topic, but I actually really like the fact that there's a lot of people online who are like, you're on the spectrum. Like Yuri is like madly in love with Viktor, but like, you know, Viktor and and Kristoff Kristoff jump in bed with them. And his first thought is your, your, your feet are cold."
"James Somerton","00:39:34:13","00:39:39:15","So it's like that is not, you know, horny, horny 20 year old. Yeah. Activity."
"Speaker 2","00:39:39:16","00:39:40:01","Yeah."
"Nick Herrgott","00:39:41:11","00:39:59:03","I like and that's okay. Like you don't and that's what I like like you say about lots of things that doesn't indie dicks and that's for it to qualify as gay like yeah if we're trying to present queer experiences, then we need to. Brod I hate saying that because like, we need to broaden our definition of what qualifies as queer experience because then we get more of this allegorical bullshit."
"James Somerton","00:39:59:10","00:40:10:14","With Nimona, we don't get the allegorical with, with trans and non-binary gender queer kind of stuff. We there is a bit of an allegory there, but with the gay stuff, it is right there."
"Nick Herrgott","00:40:10:14","00:40:14:23","Yeah. Because I don't dislike allegory and I think that it's useful and I don't. I hate."
"James Somerton","00:40:14:23","00:40:16:04","That you're not talking."
"Nick Herrgott","00:40:16:13","00:40:29:06","Right. Like I like seeing allegory. But at the same time, I also don't think that I think that hiding behind allegory is bad. So, yes, we got Nimona, it's very trans and gender nonbinary, non-conforming, and."
"James Somerton","00:40:29:06","00:40:32:03","Like Indya Moore, who is not gender."
"Speaker 2","00:40:32:03","00:40:32:16","Queer."
"Nick Herrgott","00:40:32:18","00:40:34:03","Or I think gender."
"James Somerton","00:40:34:03","00:40:36:19","Or non-binary gender fluid."
"Nick Herrgott","00:40:36:19","00:40:39:23","I think I think nonbinary non-binary is the umbrella definition."
"James Somerton","00:40:40:08","00:40:40:17","Okay."
"Nick Herrgott","00:40:42:05","00:40:44:00","I was hearing fireworks in the background."
"James Somerton","00:40:44:01","00:40:45:03","Because it's Canada."
"Speaker 2","00:40:45:03","00:40:45:23","Today."
"James Somerton","00:40:46:09","00:40:48:02","Um, we haven't left the house."
"Nick Herrgott","00:40:48:09","00:40:50:06","We haven't. It was raining for most of today."
"James Somerton","00:40:50:07","00:41:05:11","Yeah. Nick slept over last night so that we could do movie stuff. We did. We have there's going to be a video coming out in a couple of days, kind of talking about some Tello stuff. So look forward to that. So it's going to come out for for patrons as well. It's not like a video essay or anything."
"James Somerton","00:41:05:11","00:41:05:19","It's just some."
"Nick Herrgott","00:41:05:19","00:41:30:14","Explanations. So we're talking about, yeah, like allegories. So like we got Nimona and it's great, but we shouldn't keep hiding behind this because one thing that happens with these allegorical representations and I've had to take some people close to me to task for this, is it gets into the cycle of No, it was about like monsters. It was about like, you know, it wasn't specifically oh sure, non-binary people can be included, but this movie was about weirdos in general and."
"James Somerton","00:41:30:14","00:41:37:21","Even with like there was so much like, I can see how you could see this is a gay experience, but it's really just about Monster boys."
"Nick Herrgott","00:41:37:21","00:41:38:13","It's like it's a."
"James Somerton","00:41:38:17","00:41:40:02","Bunch of little queer."
"Speaker 2","00:41:40:21","00:41:41:21","A little weird."
"Nick Herrgott","00:41:43:07","00:41:44:18","They're trying to hide their colors."
"Speaker 2","00:41:45:04","00:41:46:06","Like, ah, Dahmer."
"James Somerton","00:41:49:00","00:41:58:04","But like right now with Nimona, like, I hope it takes off because it was, like, so much fun. But like, even on Rotten Tomatoes, it's got a 94% right."
"Nick Herrgott","00:41:58:04","00:41:59:20","Now for animations. That's weird."
"Speaker 2","00:42:00:02","00:42:01:12","And it's even."
"James Somerton","00:42:01:19","00:42:04:01","It's 94% among critics and."
"Speaker 2","00:42:04:01","00:42:05:14","Audiences. That never."
"Nick Herrgott","00:42:05:14","00:42:06:00","Happens."
"James Somerton","00:42:06:16","00:42:31:08","Like it is such a fun and just like especially with all the stuff that's going on, all the crap that's going on for queer people all over the goddamn globe. Yeah, that there is this animated movie on Netflix that you can watch and just enjoy is like, and I want to give a shout out to the show Glamorous, which is also also just came out on Netflix, which is another extremely queer thing on Netflix."
"Nick Herrgott","00:42:31:09","00:42:32:13","Making up for Dave Chappelle."
"James Somerton","00:42:33:10","00:42:45:16","Right that you can just watch and enjoy. And like most of the cast of Glamorous are people of color. Like it's like Kim. I think I think Kim Cattrall is like the only like white person in the cast."
"Nick Herrgott","00:42:45:16","00:42:47:12","And, you know, we we kind of stand her."
"James Somerton","00:42:47:21","00:43:07:02","Oh, yeah. Like she can she can do whatever she wants and like, yeah, Netflix is kind of making up for lost time, but it's like advertising is things like glamorous. They get quite a bit of advertising. It looks like there's probably going to be a season two. It's done quite well, but like I haven't seen maybe it's maybe, you know, in like animation circles and stuff."
"James Somerton","00:43:07:02","00:43:10:04","Nimona is like very well known, but like took."
"Nick Herrgott","00:43:10:04","00:43:13:12","The first Spider-Verse movie a little bit to kind of get word of mouth out there."
"James Somerton","00:43:13:17","00:43:30:00","Yeah. And like, I wouldn't expect like, oh, in a month or two in a month, they're going to announce a sequel. Like with movies, you can take more time than with TV shows because scheduling for a movie is much different, especially for animation, because you can be like, Oh, resume AD can only come in on this week and Chloe Grace Moretz can only come in and this week it doesn't matter."
"James Somerton","00:43:30:00","00:43:34:21","They're they're not acting together, they're in a booth, you know, it's just animators."
"Nick Herrgott","00:43:34:21","00:43:35:03","And yeah."
"James Somerton","00:43:35:03","00:43:53:05","Yeah. So far nothing has come out saying that the animators were like, tortured, tortured and, you know, put on the rack and stuff. So, you know, that's nice because everything else, apparently the animators are just treated like shit. Yeah, it's like, Oh my God, the animators need a union."
"Nick Herrgott","00:43:53:18","00:43:55:03","So many things and the union."
"James Somerton","00:43:55:22","00:44:02:13","YouTubers need a union. But yeah, it is. It was surprisingly good. I was very."
"Nick Herrgott","00:44:02:20","00:44:10:03","Very I went in with high expectations because of the Rotten Tomatoes score, I'll be honest like, and you know, my expectations were met."
"James Somerton","00:44:10:06","00:44:35:01","I kind of went in thinking like, okay, it's a kid's movie and expecting a good kid's movie. So I was a little shocked at how it it didn't like break out of the mold. It's not like it's not a kid's movie. Yeah, but it's stretched. It's yeah, it's like it is still perfectly fine for kids to watch and really good for them."
"James Somerton","00:44:35:10","00:44:36:15","There's really good message. And it took."
"Nick Herrgott","00:44:36:15","00:44:42:14","A run up to the Shrek franchise and spin offs as far as violence went, it was a little bit more violent. Graphically, it was."
"James Somerton","00:44:42:20","00:44:44:15","Closer to Puss in Boots."
"Nick Herrgott","00:44:44:15","00:44:45:02","Yes."
"James Somerton","00:44:45:02","00:44:45:18","Than Shrek."
"Nick Herrgott","00:44:45:18","00:44:54:18","I think it really went even. It was either the good puss targeting Puss in Boots, because Puss in Boots didn't show much violence against like, people. Yeah. Villains."
"James Somerton","00:44:54:20","00:44:55:05","Yeah."
"Nick Herrgott","00:44:55:18","00:44:58:22","But this was very much like, you know, like we're bastions and skulls."
"James Somerton","00:44:59:01","00:44:59:10","Yeah."
"Nick Herrgott","00:44:59:11","00:45:00:09","Violence."
"James Somerton","00:45:00:15","00:45:09:12","Like stabbing people. Yeah. And stuff like that Caused quite a bit of people got run through with swords, actually. Yeah, But, you know, just the one spurted blood."
"Speaker 2","00:45:09:20","00:45:10:01","Yeah."
"James Somerton","00:45:10:16","00:45:12:07","But yeah, like if you had it was."
"Nick Herrgott","00:45:12:07","00:45:14:06","Off screen and it wasn't from a wound."
"James Somerton","00:45:14:17","00:45:16:23","Well it was from a wound you just didn't see coming out of that."
"Nick Herrgott","00:45:16:23","00:45:20:11","That's what I mean. Like that the, the visuals didn't show it coming from a movie."
"James Somerton","00:45:20:11","00:45:28:00","And another thing I've got to say is the visuals for Pneumonias Face had me in stitches multiple times throughout the movie."
"Nick Herrgott","00:45:28:00","00:45:30:12","So much good visual comedy for that."
"James Somerton","00:45:30:12","00:45:33:03","Yeah. And Chloe Grace Moretz again, did a fantastic job."
"Nick Herrgott","00:45:33:05","00:45:35:11","Everyone did needs to get more work."
"James Somerton","00:45:35:13","00:45:54:15","She does. She keeps doing movies that aren't successful and people blame it on her. And she's like, I'm like, it's not her fault that the Carrie remake didn't do well. But yeah, you should definitely check it out. Like if you like animation, if you like gay stuff, queer stuff, you should definitely check it out. It is absolutely worth watching."
"James Somerton","00:45:54:22","00:46:09:03","I Think it was a great movie to start this new podcast Podcast's podcast off with. This'll be the podcast will be coming out on July 5th because there's no point in releasing it before on July 4th weekend. Y'all are."
"Speaker 2","00:46:09:03","00:46:09:15","Busy."
"James Somerton","00:46:10:23","00:46:23:04","So this will be coming out July 5th. We're recording it on the first, so there'll be another one next week and we're going to keep doing this because we got a lot of movies to get through and I think this is a great way to start it off."
"Nick Herrgott","00:46:23:04","00:46:25:05","It was fun. I liked this one and."
"James Somerton","00:46:25:05","00:46:27:03","We got to avoid watching Hamilton."
"Nick Herrgott","00:46:27:04","00:46:29:05","We got to avoid watching him."
"James Somerton","00:46:29:06","00:46:32:03","We were going to watch and compare the producers and Hamilton the."
"Nick Herrgott","00:46:32:03","00:46:35:16","Producers movie, the 2005 or five remake."
"James Somerton","00:46:35:21","00:46:40:03","And and I just started this last night. That was a good idea."
"Nick Herrgott","00:46:40:04","00:46:51:09","We've been dreading it. We did not want to watch Hamilton. I want to I don't want to watch. I really don't want to watch Hamilton."
"James Somerton","00:46:51:09","00:46:54:06","It's like when people ask me about the supernatural video. I'm like."
"Speaker 2","00:46:54:11","00:46:55:12","Especially with."
"Nick Herrgott","00:46:55:17","00:47:00:00","The the weird reason I don't want to watch Hannibal, and this is weird Hamilton, but I say."
"James Somerton","00:47:00:01","00:47:00:14","Hannibal."
"Nick Herrgott","00:47:00:14","00:47:01:15","Hannibal, I do want to watch."
"James Somerton","00:47:01:15","00:47:02:16","Hannibal. You watched Hannibal."
"Nick Herrgott","00:47:03:10","00:47:03:20","Where is."
"James Somerton","00:47:03:20","00:47:04:11","Season four?"
"Nick Herrgott","00:47:04:11","00:47:06:10","Where it's season four? They could just do a movie."
"James Somerton","00:47:07:09","00:47:14:14","Oh, we've talked about we won't get into the details we've talked about on stream and stuff, but trans Clarice. Trans Clarice. That's how you do The Silence of the Lambs story."
"Nick Herrgott","00:47:15:05","00:47:22:05","Um, so like, I didn't want to watch Hamilton because, like, out of all of the royals in the world."
"Speaker 2","00:47:22:19","00:47:26:18","What But correct, you out."
"Nick Herrgott","00:47:26:18","00:47:43:15","Of all the royals in the world, I actually have the most respect for King George. I don't remember it. I think it's King George the fifth. Something that specific King George, because I'm like, he struggled a lot with mental health. Yeah. And probably neurodivergent. And he stayed alive in spite of it, which."
"James Somerton","00:47:43:15","00:47:46:14","Is being dealt with on the Netflix show. Queen Charlotte."
"Nick Herrgott","00:47:46:15","00:47:49:01","Which I've heard is actually really, really good. My mom, like my."
"James Somerton","00:47:49:01","00:47:51:23","Mom brilliant, has been telling me to watch it, but I need to get through glamorous."
"Nick Herrgott","00:47:51:23","00:47:56:12","First. My mom liked Queen Charlotte, the mini series way better than George Bridgerton. She said she."
"James Somerton","00:47:56:15","00:47:59:15","Has no interest in Bridgerton, but I am interested in Queen Charlotte."
"Nick Herrgott","00:47:59:18","00:48:07:00","Tonight. I watched in for a bit of Queen Charlotte and I was like, I know it's going. I like, I like what's going on there. So yeah, quick. King George, I'm a big."
"James Somerton","00:48:07:00","00:48:15:15","Fan actor who plays King George in Queen Charlotte is also openly gay and he's playing a straight lead. Yeah, and I'm a romantic straight lead. And I'm like, Oh, boy, God, Go."
"Nick Herrgott","00:48:15:16","00:48:34:20","Yeah, go off. So like, yeah. King George dealt with a lot of mental health problems when he got to a point in his career where he couldn't continue doing public appearances, he went and actually managed the kingdom. Yeah. And fought for a lot of, you know, humanitarian rights and stuff and the rhetoric. And he was toasted well into the American Revolution by the."
"James Somerton","00:48:34:20","00:48:36:15","By the by the by the founding."
"Nick Herrgott","00:48:36:20","00:49:00:02","Fathers. Their beef was with English parliament, not the crown. Yeah, but when they started realizing we're not going to win this, they turned to a propaganda smear campaign and turned him into the mad King. Yeah. So he was not the villain of this story. And like, Hamilton kind of just represents to me this, kind of archetypical American fix for propaganda is let's replace the existing propaganda with other different propaganda."
"Nick Herrgott","00:49:00:02","00:49:00:23","That's also not true."
"James Somerton","00:49:00:23","00:49:13:02","Yeah, let's literally anyway change the Constitution. No, we'll not change the costumes, but yeah. So yeah. Thank you guys so much for listening. I hope you enjoyed it. Please leave comments in the wherever you want to leave."
"Nick Herrgott","00:49:13:06","00:49:16:13","Where they get read for Phil, for for having, you know, an inkling of support for King George."
"Speaker 2","00:49:16:14","00:49:17:03","Oh, probably."
"James Somerton","00:49:19:04","00:49:31:12","I hope you all had a wonderful 4th of July weekend. And I hope you have a wonderful coming week. And we'll be back. We actually will be back with another episode because now Nick is within driving distance and."
"Nick Herrgott","00:49:31:12","00:49:34:01","We have a format, too, because it was so hard to come up with podcast."
"James Somerton","00:49:34:02","00:49:35:10","Oh, God, it was so. And I."
"Nick Herrgott","00:49:35:10","00:49:37:10","Mean, I'll talk about anything for our ends."
"James Somerton","00:49:37:10","00:49:54:17","But now we just have a list of movies we can get them. Yeah, it's wonderful. Thank you guys so much for suggesting so many movies to. So yeah, thank you for listening. And my name is James. I'm Nick and yeah, we're going to keep going in raw. I don't know how to end it."
"Speaker 2","00:49:54:17","00:49:55:21","Okay. All right. Goodbye."
"Speaker 1","00:49:57:00","00:50:19:18","Sensitive on. Peeling back my skin to tell me. But so of this by myself, Phil just got me."
