"Speaker Name","Start Time","End Time","Text""Nick Herrgott","00:17:06:17","00:17:08:13","Her, different from, you know."
"James Somerton","00:17:09:00","00:17:09:15","Just being their."
"Nick Herrgott","00:17:09:15","00:17:12:06","Forms of suicide. Like it's it's, it's."
"James Somerton","00:17:12:13","00:17:31:17","It's, it's different from the and trigger warning. Yeah. Sorry, sorry, sorry. I'll put that in the description. Yeah. That, you know, there is, you know, suicidal ideation from being depressed and stuff like that. But it's when, when you're queer it's not so much just like general depression, it's."
"Nick Herrgott","00:17:31:23","00:17:34:06","Feel like you don't get it, like you don't belong in the."
"James Somerton","00:17:34:06","00:17:36:12","World. Yeah. Like there is a targeted depression."
"Nick Herrgott","00:17:36:20","00:17:45:15","There's no like and again, like, it's like she's been at this for a thousand years. There's no reprise. Literally every when she gets close to distance herself because she's different, she's a monster."
"James Somerton","00:17:45:15","00:17:45:22","Yeah."
"Nick Herrgott","00:17:45:22","00:17:52:19","So, you know, it's like, what? Is there a point in continuing? Yeah. And that's kind of the ideology that happens for a lot of, you know, queer people."
"James Somerton","00:17:52:22","00:18:10:05","Well, yeah, because it it kind of hangs over you. It's not like the depression that everyone says, you know, you'll go to therapy and things will get better. It's like therapy doesn't make this better. The world needs to get better. Yeah, Yeah. And she at that point in the story, like many queer people, are, like, the world's not getting better."
"Speaker 2","00:18:10:06","00:18:10:13","Yeah."
"James Somerton","00:18:10:22","00:18:17:22","It's like, yeah, there I am not. I've been here for a thousand years and it hasn't gotten better."
"Nick Herrgott","00:18:17:22","00:18:23:20","Another thing that I liked was the queer rage in regards to, you know, she's had enough. So she goes on a tirade and so."
"James Somerton","00:18:23:21","00:18:25:16","That when that's when she turns into the."
"Nick Herrgott","00:18:25:16","00:18:26:18","Kaiju. Yeah, the Chi."
"James Somerton","00:18:26:18","00:18:27:10","Just like."
"Nick Herrgott","00:18:27:10","00:18:46:12","And I all I really, really liked that because so many people kind of comment like, Oh, queer people are just so easily triggered. They're just so angry. Yeah, they want to go on there and peop some people that I'm close to say this like they just want to go on tirades for nothing. They're just so centered, they're so just angry, but they're so offended by everything."
"Nick Herrgott","00:18:46:12","00:18:53:12","And it's like, yeah, you're looking at the fifth act of that. Yeah. You don't know what happened that you're."
"James Somerton","00:18:53:12","00:19:05:01","Looking at the, you're looking at the Twitter interaction. Yeah. Where you know someone was, you know, called a name. Yeah. You're not looking at the 30 years that led up to that."
"Nick Herrgott","00:19:05:01","00:19:05:12","Yeah. Yeah."
"James Somerton","00:19:05:16","00:19:07:01","You're not taking that into account."
"Nick Herrgott","00:19:07:01","00:19:15:15","When you're getting to the point of having that rageful person. And this is why I, you know, Thank you. I dropped my fidget dragon. Um, it."
"James Somerton","00:19:15:15","00:19:16:14","Doesn't make any noise."
"Nick Herrgott","00:19:16:14","00:19:30:05","It's perfectly like I give a lot of empathy and, you know, proxy lenience to people who explode on other people online for, you know, like, oh, all I did was ask what pronouns they were using. It's like."
"James Somerton","00:19:30:21","00:19:33:01","Yeah, but that was the 80th time today."
"Nick Herrgott","00:19:33:07","00:19:51:07","And especially like, and trans people who are patrons or YouTube members can, you know, kind of chime in on this. But yeah I kind of direction for people when you know they can conflated like I just don't know what to do I'm like look at someone if they visibly look like they are trying to present feminine face she her."
"James Somerton","00:19:51:16","00:19:54:02","Or just start with they and let them correct you."
"Nick Herrgott","00:19:54:09","00:20:11:17","That can trigger some uh dysphoria for trans people though, like the kind of back back brain like, oh my God, I mean, not passing like. Yeah, that's so that's why I say if it is very apparent that they're trying to go for feminine use, she her because even if it's a guy, even if it's a guy in drag, you're like, ooh, I'm fishy."
"Speaker 2","00:20:11:23","00:20:12:11","Like, yeah."
"Nick Herrgott","00:20:12:17","00:20:13:06","So like."
"James Somerton","00:20:13:16","00:20:14:23","Ooh, I'm Courtney Act tonight."
"Speaker 2","00:20:14:23","00:20:16:09","Yeah, I'm."
"Nick Herrgott","00:20:16:09","00:20:38:14","Serving Courtney If it looks if they look like they're presenting as masculine used masculine pronouns Yeah it's and I can't quite if it's androgynous if, if it's just a guy with a beard in a skirt use they Yeah. If you are wrong they will correctly correct you. But the important part is it needs to look like you're trying to try."
"Nick Herrgott","00:20:38:15","00:20:42:08","If you see a guy who is, you know, someone who is."
"James Somerton","00:20:42:12","00:20:43:13","You know, and you might see they've."
"Nick Herrgott","00:20:43:13","00:20:48:08","Got masculine features, they've got make, but they've got makeup on, they've got a bit of a shadow and."
"James Somerton","00:20:48:17","00:21:11:18","Look, honestly, like in that kind of situation, like even if it's a situation where it's like someone who is like 100% femme, like just like got the six inch stilettos, like is wearing a miniskirt and everything. And you say she they are very likely to happily correct you as they or he. Yeah, they're not going to get offended because because they know what they're serving."
"Nick Herrgott","00:21:11:18","00:21:23:18","You know what they're serving. You know, people don't people don't get dressed in and dress dressed up in the dark like, yeah, you know, people look at themselves in the mirror when they get dressed. They know what their clothes are. They know what their wardrobe is."
"James Somerton","00:21:23:18","00:21:24:01","Yeah."
"Nick Herrgott","00:21:24:23","00:21:44:00","And like I said, if that's not what they're going for, they'll correct you what the element of when it looks like you're, quote unquote, not trying to do this is when you're trying too hard to correct the other direction. You see that person, they've got the shadow, they've got, you know, so so makeup on, masculine features, broad shoulders, but they're still wearing the dress and the full face of makeup anyway."
"Nick Herrgott","00:21:44:00","00:21:46:10","Yeah. And you say he like it's like, okay, what."
"James Somerton","00:21:46:16","00:21:47:21","They are trying their."
"Nick Herrgott","00:21:47:21","00:21:59:02","Best. What what direction are they going in? Either they're trying their best or they're putting on a pass. Either way, if they're putting on a fast and saying she her, that's going to be endearment. Even if they know like, oh honey, you think I'm passing?"
"James Somerton","00:22:00:12","00:22:01:05","Not today."
"Speaker 2","00:22:03:10","00:22:05:12","But thank thank you. Bless your heart."
"James Somerton","00:22:05:12","00:22:08:20","Like I've been in this since 5 p.m. last."
"Speaker 2","00:22:08:20","00:22:09:04","Time."
"James Somerton","00:22:11:11","00:22:18:11","I've done two shows, Anna and a matinee. Okay he's he's closing a bathroom door."
"Nick Herrgott","00:22:18:17","00:22:21:15","Bathroom door. Oh, God. I bumped into. Okay."
"Speaker 2","00:22:21:20","00:22:22:07","Okay."
"James Somerton","00:22:22:14","00:22:24:17","Yeah, The bathroom door closed properly."
"Nick Herrgott","00:22:25:04","00:22:25:13","Yeah."
"James Somerton","00:22:25:15","00:22:41:18","Okay. But yeah, like, so for the movie, I. I was so shocked watching the movie just how nonchalantly queer it was. Yeah. How at no point was it like, message. Message Like this night to homophobe? It's like, No, he's actually just an ass, so."
"Nick Herrgott","00:22:41:18","00:22:42:23","He's just an asshole."
"James Somerton","00:22:42:23","00:22:44:22","Yeah, he's. He's just a douche nozzle."
"Nick Herrgott","00:22:44:22","00:22:48:05","Like, if you can still be not homophobic and just be an asshole."
"James Somerton","00:22:48:05","00:22:50:18","Yeah, it was like, Yeah, they're gay. Nobody gives a fuck."
"Nick Herrgott","00:22:50:18","00:22:51:12","Nobody cares."
"James Somerton","00:22:51:16","00:23:00:10","Like, there is no issue brought up about it. It's like if if you're if you're a four year old and you're watching this movie, it's oh, those two nights are holding hands."
"Nick Herrgott","00:23:00:10","00:23:05:07","Because the thing is, society has been conditioned to fear monsters. They don't give a crap who you kiss."
"Speaker 2","00:23:05:12","00:23:07:01","Yeah, yeah, exactly."
"Nick Herrgott","00:23:07:01","00:23:22:09","That's the things. And there's like a this is a broader sense of what you could talk about and kind of my crusade recently is like, people just need something to be afraid of. Yeah. So they're going to pick something. And that's why this kind of LGB movement is not going to work, because the objective."
"James Somerton","00:23:22:09","00:23:24:08","Quiet since the Supreme Court had the."
"Nick Herrgott","00:23:24:09","00:23:36:20","Objective is to be afraid of people. The objective is to find someone to hate is unity through hatred. Yeah. Um. And it doesn't matter who. If someone's been stamped down, they're going to look for something else."
"James Somerton","00:23:37:04","00:23:48:09","Oh, yeah. Like, if, you know, like, right now, you know, there's that meme going around, like we got rid of the non binaries and the trans is and everything. Who's next. And it's the look, it's like."
"Nick Herrgott","00:23:48:09","00:23:51:03","Yeah, it's, it's the maga hat guy kind of looking and just like."
"James Somerton","00:23:51:12","00:23:52:16","Uh, who's the."
"Nick Herrgott","00:23:52:16","00:23:56:03","Anarchist look the unicorn like, Yeah, yeah. Adam Schlesinger That comic, I think. Right."
"James Somerton","00:23:56:07","00:23:56:16","I'm not."
"Nick Herrgott","00:23:56:16","00:23:57:08","Sure. Okay."
"James Somerton","00:23:57:12","00:24:03:07","But it's, it's, it's like gone viral because like, people are just like, this is going to happen. This is going to happen. And then the horrible."
"Nick Herrgott","00:24:03:07","00:24:08:08","Thing is that that happened before any of this was under discussion in the Supreme Court."
"James Somerton","00:24:09:00","00:24:29:03","Oh, yeah. And like everybody knew everybody knew it was going to happen. And now it is. And, you know, it's it is happening. This is it is honestly, to me, I think. And, you know, it's horrible that this happened with the Supreme Court. I hate that America is going through such a shitstorm right now, especially after like the Obama years where it seemed like things were getting better."
"Nick Herrgott","00:24:29:03","00:24:31:01","Americans deserve better than America."
"James Somerton","00:24:31:04","00:24:46:04","They did. I tweeted something close to that, but that it's like all you gays. And we're like, fuck the trans is fuck trans people, fuck trans people, nonbinary people, fuck them. Fucking fuck them. Yeah. How'd the Supreme Court take down?"
"Nick Herrgott","00:24:46:05","00:24:46:14","Yeah."
"James Somerton","00:24:46:22","00:24:51:10","They took down you. They? Yeah. Like, yeah, the hate. The trans cases haven't come yet."
"Nick Herrgott","00:24:51:15","00:24:57:15","Hmm. Yours did. But this was always going to happen. Yeah, this was all we put out. A video of several."
"Speaker 2","00:24:57:23","00:24:59:12","Multiple one of you."
"Nick Herrgott","00:24:59:12","00:25:07:13","All complaining that we're too negative lately. It's like we were kind of. We're too homophobic. One homosexual man in a person, vaguely."
"Speaker 2","00:25:08:18","00:25:09:08","In a vague."
"James Somerton","00:25:09:08","00:25:10:18","And a vague and insane shape."
"Speaker 2","00:25:11:13","00:25:11:18","Of a."
"Nick Herrgott","00:25:11:18","00:25:12:10","Person."
"Speaker 2","00:25:12:17","00:25:13:06","We're having a."
"Nick Herrgott","00:25:13:06","00:25:14:19","Mental breakdown from over here."
"Speaker 2","00:25:14:19","00:25:18:06","Being like, just like both."
"Nick Herrgott","00:25:18:06","00:25:36:00","Of us. So much of our dreams are kind of wrapped up in this vague idea of America. Like you have your Hollywood, Hollywood. It's impossible to publish in Canada. So of course I want to be tethered to America because that's where a large audiences and yeah, you know, like, you know, Marina Diamandis once said, I'm obsessed with the mess that's America."
"Nick Herrgott","00:25:37:06","00:25:55:09","I don't I feel bad. And, you know, once again, followers chime in because I really don't know. I've kind of gotten a little bit of terrified out of her. Mm. I don't know. I don't want to assume that about her because she's been such a sweetheart for the rest of her career. But yeah, whenever more recent albums, there were a few lyrics in there and I was like, Mm hmm."
"Nick Herrgott","00:25:55:09","00:26:00:23","Like, and I can see, like, there is a way you could be coming from this that is supportive, but this also could be a dog whistle."
"James Somerton","00:26:01:00","00:26:03:11","Well, it's always it's always you never know."
"Nick Herrgott","00:26:03:18","00:26:06:18","And I want to give her the benefit of the doubt. That's the thing. Because I think that well."
"James Somerton","00:26:06:18","00:26:17:17","That's that's kind of what happened with Bette Midler is Bette Midler said some terrific stuff and a lot of people were like, you know, canceled. But oddly, a lot of trans people were like, give her a minute."
"Nick Herrgott","00:26:17:17","00:26:18:02","Yeah."
"James Somerton","00:26:18:10","00:26:21:07","And then she immediately came out was like, well, I'm a fucking idiot, really?"
"Nick Herrgott","00:26:21:10","00:26:28:23","Because Bette Midler has a history of, like, being a loud mouth. Yeah. Like saying things before she really realizes it and then realizing, Oh, well, I have been correct."
"James Somerton","00:26:28:23","00:26:43:19","And as far as I know, she's corrective incorrect. She has really reversed everything that she said before Hocus Pocus two came out. She didn't say anything like Rowling ask anything like that. It was just like it was like."
"Nick Herrgott","00:26:44:10","00:26:53:03","But it's one of those things. Phrasing. Yeah, it's one of those things like there needs to be a specific word for this. Aside from dog whistling, it's like, I could read this either way in this person, I don't know."
"Speaker 2","00:26:53:03","00:26:53:16","Like, yeah."
"James Somerton","00:26:53:20","00:27:06:13","And it's like, you know, Bette Midler is and has been an ally for a very long time. And it is so, you know, it's figuring out like who's being malicious and who's just who's being so flippant."
"Nick Herrgott","00:27:06:13","00:27:10:01","Yeah. Yeah. And, you know, you and I are both very flippant people."
"James Somerton","00:27:10:04","00:27:17:17","Yeah. And I've said things on stream and people in the chat are immediately like, James, you want to take that back?"
"Nick Herrgott","00:27:18:18","00:27:20:06","I been there for that."
"James Somerton","00:27:20:06","00:27:28:04","So it's nothing like super duper offensive. It's mostly just like, like, like just talking too much."
"Speaker 2","00:27:28:08","00:27:28:17","Yeah."
"Nick Herrgott","00:27:29:06","00:27:41:10","So like, like I saying, I was like, what the Mrs. America like, so, like, I a multiple of my book ideas take place in America and like, I don't really know how to respond to that with America kind of falling apart the way that it is."
"James Somerton","00:27:41:11","00:27:41:17","Yeah."
"Nick Herrgott","00:27:42:02","00:27:44:18","Um, aside from just, you know, keep checking on."
"James Somerton","00:27:45:08","00:28:07:01","Well, yeah. And, you know, it's with Nimona in it, it's oddly timely because, you know, it's this story of a large group of people just looking for something to be afraid of. Yeah. And the power structure saying, let's give you something to be afraid of. Because if you're afraid, it's so much easier for."
"Nick Herrgott","00:28:07:01","00:28:18:17","Us to not control. But she kind of becomes the monster that they accuse her of. Yeah, because she's just pushed into that territory like there's nothing else to do, which is actually kind of a theme of the next novel in my book."
"Speaker 2","00:28:18:17","00:28:20:18","But it's the next couple."
"James Somerton","00:28:21:23","00:28:29:05","And I do have to say Chloe Grace Moretz, who voiced Nimona. Yeah, Yeah. You know. 30 Rock alum."
"Nick Herrgott","00:28:29:17","00:28:40:07","Yeah. Oh, yeah. Well, she was the queen of fortune for a brief time, so there was contention between her and Boxy. And then I couldn't really I didn't stick around for Jane for long enough to figure out who won that I've."
"James Somerton","00:28:40:07","00:28:56:05","Never been on Fortune. It's but she did she did such a good job with the voice work. Everyone did it. I was I was really shocked when I was going through the credits because I didn't I didn't realize it was Eugene from the dry guys. First of all, I was like, Oh, he can be really good voice actor."
"Nick Herrgott","00:28:57:12","00:29:01:22","Well, I kind of felt he was the weaker of the collection. There were a few line deliveries."
"James Somerton","00:29:02:05","00:29:15:19","And the thing is, like, I've watched a lot of try guys videos. It didn't, it wasn't him. Yeah, like it wasn't his personality. RuPaul and and Indya Moore have voiced cameos as news broadcasters. I was like, Wow, they cleared the hell out of this."
"Nick Herrgott","00:29:15:19","00:29:28:14","Yeah. And so, like, they weren't trying to make it ambiguous. They were doing, you know, queer in front of and behind the camera. They were doing allegory. This was allegorical trans representation. Okay, good. We got this. Let's not keep going with allegory."
"James Somerton","00:29:29:06","00:29:37:09","Yeah, actual right. It's like, okay, there is an allegorical trans representation. We're not going to do allegorical gay representation. So boys kissing."
"Nick Herrgott","00:29:37:09","00:29:39:00","Yeah, we don't need that anymore."
"James Somerton","00:29:39:00","00:29:51:09","Like, it's like, Come on, come on. It's 20, 23. Jesus Christ. Yeah. And it was just really shocking. Like, there's been so much good animation this year with Puss in Boots and Spider-Man."
"Nick Herrgott","00:29:51:10","00:29:53:10","An American animation renaissance."
"James Somerton","00:29:53:11","00:29:58:22","Like, I think animation American animation is finally saying, we don't have to just be for."
"Nick Herrgott","00:29:58:22","00:29:59:09","Kids."
"James Somerton","00:30:00:01","00:30:17:03","And, you know, there's always been American animation that's done that Ralph Bakshi and stuff like that. But it's always kind of been like South Park adjacent where it's like it's not just for kids, but kids can't watch it now. It's kind of all ages means, yeah, your ten year old can watch it and you 40 year olds can watch it and enjoy it."
"Nick Herrgott","00:30:17:03","00:30:23:08","So very mature for a kid show to like it. Oh, yeah. Access it Like it's like we say about Star Wars. It's kid accessible."
"James Somerton","00:30:23:08","00:30:26:11","Yeah. Like there was a little bit of blood. Not much. There was a spurt that was it."
"Nick Herrgott","00:30:27:05","00:30:28:22","Was a juice box."
"James Somerton","00:30:30:07","00:30:50:11","No, no. When when she got hit, right? When she took the arrow to the knee, there was like he pulled it out a little and spurted and. Yeah. But there was like there was some violence. There was, you know, there was no cursing, no, there was no nothing sexual. Almost cursing almost at the very end. Yeah, there was nothing sexual."
"James Somerton","00:30:50:11","00:30:55:12","The closest thing to sex was a leg, a quick peck between the two guys at the very end."
"Nick Herrgott","00:30:56:11","00:31:00:13","And a lot of very strong sexual tension. Sexual tension?"
"Speaker 2","00:31:00:13","00:31:01:19","Continued tension."
"James Somerton","00:31:01:19","00:31:02:03","Yes."
"Nick Herrgott","00:31:02:16","00:31:09:00","Oh, I. Yeah, I understand why they brought them back together at the end, but I'm still like, I wouldn't know if I. If."
"James Somerton","00:31:09:17","00:31:15:12","If I had my extra half hour, I would have had like the sort of Daniel Marshall where he's like."
"Nick Herrgott","00:31:15:13","00:31:17:02","There's a lot of broken trust."
"James Somerton","00:31:17:02","00:31:20:14","Hi. Can I come in? No, just like."
"Nick Herrgott","00:31:20:18","00:31:22:01","We're not. We're not there."
"James Somerton","00:31:22:01","00:31:31:04","Yet. Like, Yeah, like make him kind of earn his way back in. And, like, he was hot, though, so I get it. But at the same time, I'm like, he was."
"Nick Herrgott","00:31:31:04","00:31:49:00","Hot, but privileged and like. Like very pretty. But that's the thing that this, this also didn't explore in a way that I wish I wish if it was longer than it could have, because they could have explored that wealth dichotomy. Because I've heard this. Yes, I brought this up before, but I've heard from multiple people, poor people being like, Yeah, I dated a rich guy once."
"Nick Herrgott","00:31:49:00","00:31:54:20","He asked what my favorite cheese was. I didn't know what to answer. I said cheddar, and he looked egregiously offended."
"James Somerton","00:31:55:21","00:31:59:13","I was going to say brioche. That's not cheese, that's bread. But like."
"Nick Herrgott","00:31:59:13","00:32:01:14","Like that Brie."
"James Somerton","00:32:01:14","00:32:02:03","Is cheese."
"Nick Herrgott","00:32:02:03","00:32:03:00","Though. He is."
"James Somerton","00:32:03:02","00:32:03:19","I don't like it."
"Nick Herrgott","00:32:05:08","00:32:12:15","So, like. Like that kind of dichotomy. Like, I kind of I talked about this in the tragedy being rich. Yeah. The idea of like."
"James Somerton","00:32:12:15","00:32:17:05","Which is the young Royals video Young Royals season three has just wrapped so watch tragedy of being right."
"Nick Herrgott","00:32:17:05","00:32:33:14","There. There is like this compulsive incompatibility between rich and poor people that there needs to be a lot of work to get over. Yeah. In a way that rich people just do fundamentally do not understand how poor people function or how you can function any other way."
"James Somerton","00:32:33:17","00:33:02:09","And there's also, you know, there is also from the poor perspective, I think for a lot of people, you know, for a lot of poor people, it's like I got I can have a rich boyfriend, fuck, yes. But a lot of people who have like dated someone who has money, huge inadequacy. Yeah. Like I've talked to people who they they think I'm, like, super rich because I have a semi-successful YouTube channel and they find out I have like, they see my YouTube channel and they see like, wow, 300,000 subscribers."
"James Somerton","00:33:02:15","00:33:15:19","They immediately think I'm like, fucking Jenna marbles over here. Yeah, yeah. And it get they get quiet and it seems like there's a power imbalance and I'm like, I, it's, I probably make less money than you do."
"Speaker 2","00:33:16:01","00:33:17:13","Yeah. Like so."
"Nick Herrgott","00:33:18:04","00:33:18:12","Yeah."
"James Somerton","00:33:18:12","00:33:20:03","And power imbalance isn't there."
"Speaker 2","00:33:20:13","00:33:20:16","Yeah."
"Nick Herrgott","00:33:21:02","00:33:29:15","Um, so that wasn't in there and that was, it was hinted. But again, like another reason, like if you were going to explore the reason why they would separate."
"James Somerton","00:33:29:18","00:33:44:04","I think they were kind of like we are. I feel like the thought process was probably like we've got gay nights and we've got a trans or gender queer allegory. Let's not muddle that down with economic issues. Yeah."
"Nick Herrgott","00:33:45:05","00:33:47:06","Because it was kind of fun. Like with the mistrust of."
"James Somerton","00:33:47:06","00:34:11:00","The past, it was trust touched on. But like, I think that's something they could do in a sequel because it's like, okay, you know, these characters are queer now you get it. You know, this character can switch genders and I can do anything that they want. So we can deal with something that like, okay, the basically the church is gone now, but there's still a very ingrained mistrust."
"Nick Herrgott","00:34:11:00","00:34:11:19","Of the poor."
"James Somerton","00:34:11:20","00:34:14:04","Yeah. And like that could be very good sequel."
"Nick Herrgott","00:34:14:04","00:34:14:15","Fodder."
"James Somerton","00:34:15:16","00:34:24:18","Because it's like, you know, what kind of monster grows out of, you know, that kind of. Yeah. Hatred toward the someone lesser than you. Yeah."
"Nick Herrgott","00:34:25:10","00:34:25:19","One thing I."
